{
  "schemaVersion": 1,
  "source": {
    "repository": "lonestone/lonestone-boilerplate",
    "remote": "https://github.com/lonestone/lonestone-boilerplate.git",
    "currentVersion": "1.2.0"
  },
  "trackedDomains": [
    "tooling",
    "api",
    "frontend",
    "ci",
    "docker-env",
    "monitoring",
    "email",
    "auth",
    "storage",
    "ai"
  ],
  "intentions": {
    "applied": [],
    "skipped": []
  }
}
